{
  "workerName" : "influx-worker-1",
  "workerUrl" : "http://localhost:8082",
  "workerThreads" : 3,
  "workerPercentage" : 100,
  "tsdbEndpoints" : [ {
    "endpointName" : "influx-zoneA",
    "tsdbUrl" : "http://127.0.0.1:8086",
    "tsdbToken" : "YcqeMSEqzrvDsPevnsPA9fuES38RU-R9_y9UZ2gefEYaNJfVdUOVdj5NvrPpwNnmVuGoZSsqZ_jxnKx9dhdHYw==",
    "endpointPercentage" : 100
  } ]
}